FECHA ,FUENTE,TEXTO,LINK ,ETIQUETA
18 DE JULIO DE 2019,ELTIEMPO,"El estudio 'Contenido de mercurio en comunidades étnicas de la subregión planicie de la Amazonia colombiana' arroja datos alarmantes sobre las consecuencias del mercurio en la salud humana y en el ecosistema de los ríos Caquetá, Apaporis, Puré y Cotuhé. Este territorio ha estado expuesto a varias olas extractivas y conflictos que ponen en riesgo sus ecosistemas. Uno de los fenómenos que ha afectado la zona es la minería ilegal, actividad en la que se utiliza el mercurio, dice el estudio realizado a través de la Dirección Territorial Amazonia, y con el apoyo de la Universidad de Cartagena y la Fundación Gordon and Betty Moore.",https://www.eltiempo.com/vida/medio-ambiente/cifras-sobre-el-mercurio-en-la-amazonia-389664,CONTAMINACIOÓN POR MINERIA
09 de Marzo de 2023,SALUD,"Las poblaciones del Amazonas sufrieron una selección natural a causa del patógeno del Chagas y su genética se fue adaptando hasta tener una variante resistente a esta enfermedad, según ha descubierto un estudio coliderado por el Instituto de Biología Evolutiva (IBE-CSIC-UPF) y la Universidad de Sao Paulo (Brasil).",https://www.20minutos.es/salud/biologia-chagas-hallan-una-variante-genetica-que-protege-del-chagas-a-habitantes-del-amazonas-5108016/,Indigenas
02 de Septiembre de 2020,Colombia,"Cuando alguien se atrevía a afirmar o a vaticinar que la selva amazónica sería tan solo un buen recuerdo si la deforestación y los incendios se seguían produciendo en ella, muchos se iban en contra de quien pronunciaba dichas palabras y lo consideraban exagerado, pues resulta que al paso que vamos, esos comentarios parecerán una dura sentencia contra una región que no para de arder.
",https://www.colombia.com/actualidad/internacionales/los-incendios-no-se-apagan-en-el-amazonas-279403,Deforestacion 
12 de Enero de 2023,Internacional,"La Armada colombiana rescató a 23 personas que estaban a la deriva en dos embarcaciones, una de ellas de bandera brasileña, en el río Amazonas, informó este viernes la institución castrense.

","
https://www.20minutos.es/noticia/5091851/0/rescatan-en-colombia-a-23-personas-que-estaban-a-la-deriva-en-el-rio-amazonas/
",
18 de Marzo de 2023,INFOBAE,Desde que el Estado colombiano firmó el Acuerdo Final de Paz con la guerrilla de las Fuerzas Armadas Revolucionarias de Colombia (Farc) en 2016 se evidenció que la Amazonía se ve amenazada por la deforestación acelerada.,https://www.infobae.com/colombia/2023/03/18/la-amazonia-colombiana-perderia-4-millones-de-hectareas-de-bosques-para-2040/,Deforestacion 
05 de Abril de 2023,El Espectador,"Desde que comenzó la pandemia la minería ilegal en la Amazonia colombiana ha incrementado. Además de las problemáticas ambientales que trae el mercurio utilizado en estas actividades, monitoreos satelitales evidenciaron que desde 2020 ha aumentado más del 1.000 % sobre el río Puré y los mineros tienen enclaves en el Parque Nacional Natural Río Puré, a pocos kilómetros de un pueblo en aislamiento.","https://www.elespectador.com/ambiente/amazonas/el-aumento-de-la-mineria-ilegal-amenaza-a-un-pueblo-del-amazonas-en-aislamiento/
",Mineria Ilegal
24 de Noviembre de 2022,Euronews,"Una operación especial de las Fuerzas Militares y la Policía en el marco del Plan Perseo ha destruido los equipos de producción minera que, según las investigaciones, pertenecían a grupos armados vinculados al narcotráfico.","https://es.euronews.com/2022/11/24/la-policia-y-el-ejercito-de-colombia-desmantelan-la-mina-ilegal-que-devastaba-las-selvas-d
",Mineria Ilegal
15 de Diciembre de 2022,Dialogo Americas,"La Fuerza Pública de Colombia no descansa en la lucha contra el narcotráfico, logrando resultados cada vez más contundentes. A finales de octubre las autoridades destruyeron 71 laboratorios ilegales de organizaciones narcotraficantes en la región Amazónica colombiana, informó la Armada de Colombia en un comunicado.","https://dialogo-americas.com/es/articles/autoridades-colombianas-destruyen-71-narco-laboratorios-en-la-amazonia/
 
",Narcotrafico
03 de Enero de 2023,El Pais,"En Güerima, Vichada, a las puertas de la Amazonía colombiana, las antiguas pistas del narcotráfico sirven para transportar cacao a los campesinos que abandonaron los cultivos ilícitos en esta región pobre, despoblada y sin carreteras",https://elpais.com/america-colombia/2023-01-03/el-pueblo-colombiano-que-cambio-la-coca-por-cacao.html,Narcotrafico
25 de Febrero de 2023,RTVE,"La deforestación sin freno de la selva amazónica ha disparado las alarmas en Colombia. Hay una combinación de factores pero el principal enemigo de los bosques no es el cultivo de coca, ni la minería ilegal.
Según los expertos, los bosques colombianos se enfrentan a un nuevo enemigo: la ganadería, que se ha convertido en uno de los principales motores de la deforestación.",https://www.rtve.es/noticias/20230225/ganaderia-deforestacion-colombia/2427635.shtml,GANADERIA Y DEFORESTACIÓN
28 de Mayo de 2023,El Pais,"Sobre la ciudad de San José del Guaviare, un remanso en la Amazonia colombiana, un helicóptero de la época de la guerra en Vietnam repleto de agentes de la policía judicial y el Ejército se eleva hacia el cielo. A medida que vuela hacia el sur, el mosaico de fincas ganaderas atravesado por caminos de arcilla roja se disuelve en parches de vegetación desfigurados por la deforestación. ",https://elpais.com/america-futura/2023-05-28/los-bosques-de-colombia-victimas-silenciosas-de-la-guerra-contra-las-drogas.html,Narcotrafico
6 Septiembre 2017,SEMANA,"Eso es lo que está pasando en San Vicente del Caguán, el municipio más deforestado del Caquetá con 18.000 hectáreas derribadas el año pasado, desde principios de agosto varios pobladores de la zona han ingresado a un área de reserva forestal instituida por la propia comunidad para tumbar el bosque y establecer pastos para la ganadería. El saldo, dice él, son al menos 2.000 hectáreas deforestadas hasta ahora y con grandes posibilidades de aumentar en los próximos meses.",https://www.semana.com/medio-ambiente/articulo/talas-de-arboles-en-caqueta-y-la-amazonia-colombiana-por-culpa-de-la-ganaderia/38577/,DEFORESTACION
21 Abril 2021,FAC,"se logró la captura de tres personas por el delito de aprovechamiento ilícito de los recursos naturales.

Las personas, que fueron capturadas en flagrancia, venían realizando un invaluable daño ambiental al acabar con la vida de cerca de 1.300 árboles del sector, siendo además reincidentes en el mismo delito, los aprehendidos se encuentran direccionados al parecer, por el Grupo Armado Organizado residual frente ‘Jorge Briceño Suárez ’.",https://www.fac.mil.co/es/noticias/capturados-3-hombres-por-delitos-ambientales-en-caqueta,RECURSOS ILICITOS
21 Abril 2017,EL TIEMPO,"La mayor parte de la deforestación se debe a la construcción de vías terciarias, no porque destruyan los bosques, sino porque es por ahí que llegan los nuevos colonos. Le sigue la tala y quema para ganadería, y en tercer lugar, los cultivos de coca que han aumentado en el departamento. Esto ocurre en zonas con bosques que tardaron miles de años en crecer y que son el hogar de una flora y fauna única.",https://www.eltiempo.com/vida/medio-ambiente/la-selva-del-guaviare-y-su-lucha-contra-la-deforestacion-119808,DEFORESTACION
23 Julio 2015,POLICIA ,"La operación dignidad uno se llevó a cabo en el Rio Vaupés, en  la desembocadura del caño Cuyarí donde sin importar las condiciones geográficas unidades del Escuadrón Motorizado Delta, en atención a la necesidad de proteger, cuidar y  conservar el medio ambiente lograron la captura de 11 personas  en edades promedio de 19 a 59 años de edad y tres menores de edad, fueron sorprendidos  en  flagrancia en momentos en que extraían material de arrastre del río Vaupés, lo cual al parecer estaría originando incisión general del cauce, erosión remontante,  descenso en los niveles freáticos, pérdida de la flora y la fauna acuáticas y en general, desequilibrio del río.",https://www.policia.gov.co/noticia/en-defensa-del-r%C3%ADo-vaup%C3%A9s-ofensiva-contra-la-miner%C3%ADa-ilegal,EXTRACCION DE RECURSOS NATURALES
01 Septiembre 2015,EL UNIVERSAL,la corte constitucional ordenó suspednder cualquier actividad minera en un millon de hectareas en los departamentos  de vaupés y Amazonas.,https://www.eluniversal.com.co/colombia/suspenden-explotacion-minera-en-un-millon-de-hectareas-en-amazonas-y-vaupes-204497-FTEU306201,MINERIA ILEGAL
02 Mayo 2019,FAC,"Tras una constante presión militar ejercida por tropas del Ejército Nacional y de la Armada de Colombia, que inició en el departamento de Vichada, fue incautada más de media tonelada de clorhidrato de cocaína, que era transportada a bordo de una embarcación sobre el río Guainía, en el municipio de Inírida.",https://www.fac.mil.co/es/noticias/incautaron-media-tonelada-de-cocaina-en-el-rio-guainia,NARCOTRAFICO
05 Marzo 2023,CARACOL RADIO,"la alcaldía de San Vicente del Caguán dio a conocer que “debido a los últimos acontecimientos ocurrido en las plataformas Capella, en la vereda los Pozos y Bruselas, se han ocasionado derrames de sustancias químicas que pueden llegar a contaminar fuentes hídricas cercanas”.",https://caracol.com.co/2023/06/01/madera-plastica-una-iniciativa-para-ponerle-fin-al-hurto-de-rejillas-de-hierro-en-neiva/,CONTAMINACION
13 Enero 2022,SEMANA,"La búsqueda por encontrar una gota de agua es algo que a los habitantes del departamento del Caquetá cada vez se les hace más difícil. El agua potable en esta parte del país está ausente y niños, jóvenes, adultos e indígenas tratan de hallar alguna solución.",https://www.semana.com/sostenibilidad/medio-ambiente/articulo/sequia-en-caqueta-mas-de-2500-familias-se-encuentran-sin-agua/202226/,ESCASEZ
19 Julio 2021,MONGABAY,"En junio de 2021 varias comunidades indígenas vieron cinco embarcaciones haciendo minería ilegal en el río Caquetá. Imágenes satelitales llegaron a mostrar hasta 19 embarcaciones en el mismo mes en el Río Puré, uno de sus afluentes.",https://es.mongabay.com/2021/07/mineria-ilegal-en-el-rio-caqueta-continua-el-peligro-para-los-indigenas-amazonicos-de-colombia/,MINERIA ILEGAL
16 DE OCTUBRE DEL 2021,RADIO NACIONAL DE COLOMBIA,"Los municipios de Puerto Guzmán, Puerto Leguízamo, Puerto Asís y Puerto Caicedo registraron cerca de 11 mil hectáreas deforestadas, lo que corresponde al 85 % de zonas afectadas por esta problemática ambiental en el Putumayo.                                                                 Los municipios con mayor deforestación han sido Puerto Guzmán, con alrededor de 1.953 hectáreas, y Puerto Leguízamo, con 1.144 hectáreas, en el 2021",https://www.radionacional.co/regiones/putumayo/deforestacion-leguizamo-hectareas-afectadas,DEFORESTACIÓN
9 DE JUNIO DEL 2021,EL ESPECTADOR,"La Oficina de las Naciones Unidas contra la Droga y el Delito (UNODC) en cabeza de Pierre Lapaque reportó una reducción del 7% en el área sembrada con coca en el país, pasando de 154.000 hectáreas en 2019 a 143.000 en 2020. “La capacidad de obtención de cocaína por hectárea se ha incrementado en los últimos años a pesar de la reducción del área sembrada”, señaló el alto funcionario y añadió que en los departamentos de Nariño y Putumayo se completaron tres años consecutivos con reducciones de siembra ilícita",https://www.elespectador.com/judicial/la-unodc-reporto-reduccion-de-siembra-de-coca-en-el-pais-en-un-7-teniendo-143-mil-hectareas-activas/,CULTIVOS ILICITOS
21 JUNIO DEL 2022,DIALOGO AMERICAS,"En lo que va de 2022 y hasta finales de mayo, en el área central del departamento del Chocó, la Fuerza Pública junto con la Fiscalía General de la Nación y la Corporación Autónoma Ambiental del Chocó, Codechocó, ubicaron y destruyeron 20 maquinarias amarillas y 11 dragas y dragones. También destruyeron 49 unidades de producción minera ilegales, 27 motores, y un bote.",https://dialogo-americas.com/es/articles/armada-de-colombia-golpea-mineria-ilegal-en-el-choco/,MINERIA ILEGAL
13 AGOSTO DEL 2023,SEMANA,"La extracción ilícita de minerales no para en diferentes regiones del país, pese a las restricciones existentes de movilidad para controlar la pandemia del coronavirus.                                                                                                                Su nocivo impacto ambiental, por tanto, tampoco da tregua. Un ejemplo de su implacable efecto sobre el medioambiente fue el que encontraron en las últimas horas tropas del Batallón de Artillería Nº. 27, de la Vigésima Séptima Brigada del Ejército Nacional, en la vereda conocida como Las Minas, del corregimiento de Puerto Umbría, en el municipio de Villagarzón (Putumayo). ",https://www.semana.com/medio-ambiente/articulo/destruyen-gigantesco-complejo-de-mineria-ilegal-en-putumayo-i-colombia-hoy/54100/,MINERIA ILEGAL
2 OCTUBRE DEL 2018,SEMANA,"Los acuerdos se dieron en una reunión entre gobernadores indígenas de diferentes etnias, líderes de Acilapp y funcionarios del Instituto Colombiano de Desarrollo Rural (Incoder), que los avalaron.                                                         Más pastos, menos selva. La invasión de tierras también la sufren siete familias de la etnia coreguaje, que pertenecen al asentamiento Chaibajú.",https://www.semana.com/impacto/articulo/la-ganaderia-arrasa-los-bosques-del-putumayo/41798/,GANADERIA
22 DICIEMBRE DEL 2022,EL ESPECTADOR,"Su ubicación estratégica, pues limita al norte con el río Pepino, al sur con la quebrada La Ardita y al oriente con el río Mocoa, convierten las más de 100 hectáreas que componen el área de conservación en un lugar fundamental para la flora y fauna de la selva amazónica, ya que es el principal lugar de paso y recuperación de animales víctimas de una de las problemáticas que más afecta al departamento por ser un lugar de extracción: el tráfico ilegal de fauna y flora. El Centro de Recepción y Recuperación de Animales Silvestres del CEA recibe anualmente cerca de 500 ejemplares decomisados por la autoridad ambiental.",https://www.elespectador.com/ciencia/la-finca-ganadera-que-transformo-la-conservacion-ambiental-en-el-putumayo-article/,FAUNA Y FLORA
27 DICIEMBRE DEL 2019,SEMANA,"Las imágenes captadas en los sobrevuelos realizados por la Fundación para la Conservación y el Desarrollo Sostenible (FCDS) entre noviembre y diciembre en varios parques nacionales naturales dejan en evidencia la magnitud del problema. Enormes parches de árboles talados se observan en los territorios estatales. Cicatrices que dan paso a la expansión ganadera o agrícola, o a la siembra de cultivos ilícitos.",https://www.semana.com/impacto/articulo/advierten-sobre-el-reinicio-de-deforestacion-en-parques-nacionales-naturales/48258/,DEFORESTACIÓN
5 NOVIEMBRE DEL 2020,NATIONAL GEOGRAFIC,"El humo emana de la Amazonia en llamas mientras las finas partículas de carboncillo caen suavemente sobre el suelo. En el último recuento, había más de 93 000 incendios activos en la Amazonia brasileña, un incremento de un 60 por ciento frente a la misma época el año pasado y la cifra más alta desde 2010. Además, según la NASA, los incendios de este año son más intensos que en años anteriores.",https://www.nationalgeographic.es/medio-ambiente/2019/09/antiguos-agricultores-quemaron-amazonia-incendios-modernos-diferentes,DEFORESTACIÓN
2 SEPTIEMBRE 2019,NATIONAL GEOGRAFIC,"La deforestación se ha intensificado en 2019, lo que ha provocado miles de incendios que arrasan el sur de la cuenca amazónica. Los datos del Instituto Nacional de Investigación Espacial de Brasil (INPE, por sus siglas en portugués) muestran un incremento de un 85 por ciento en los incendios respecto al 2018.",https://www.nationalgeographic.es/medio-ambiente/2019/08/incendios-amazonas-brasil-causados-por-deforestacion,DEFORESTACIÓN
09 FEBRERO 2022,EL PAIS,"“A pesar de que ya hay sitios con pocos remanentes de bosques, el tamaño de la deforestación y de las quemas sigue siendo enorme. Hay sitios que están quedando con un cambio de cobertura definitivo, algunos de ellos corresponden a corredores de conectividad ecológica que eran cruciales”, explica Botero, ya en tierra, en la sede de la FCDS en San José del Guaviare, a manera de balance. “Estamos entrando en un punto de inflexión. Es posible que antes haya habido más área deforestada, pero no necesariamente con esta intensidad”.",https://elpais.com/clima-y-medio-ambiente/2022-02-09/arde-la-amazonia-colombiana.html,DEFORESTACIÓN
13 DE ENERO DE 2022,W RADIO,"Una embarcación naufragó en el río con 12.000 galones de gasolina y 8.000 de Acpm. El barco “Luna Azul” de la empresa Transportes Caribe, que cubría la ruta Puerto Asís- Puerto Leguízam",https://www.wradio.com.co/2023/06/01/solucion-electrica-en-plato-magdalena-implica-intervencion-de-afinia-air-e/,
9 DE FEBRERO DE 2022,EL PAIS,"Arde la Amazonía colombiana
La deforestación desbocada dispara las alarmas de los ambientalistas. EL PAÍS sobrevuela las áreas más afectadas por la tala y quema de bosques. Las llamas devoran, una vez más, la Amazonía colombiana. Pocos minutos después de que la avioneta despega del aeropuerto de Villavicencio, la puerta de entrada a la inmensidad de las llanuras que dominan la mitad sur de Colombia, se comienza a observar las copiosas columnas de humo. ",https://elpais.com/clima-y-medio-ambiente/2022-02-09/arde-la-amazonia-colombiana.html,
17 DE JUNIO DE 2020,NOTICIAS CARACOL,"Las manos heróicas que están detrás de la reforestación del Amazonas durante la pandemia
Sus esfuerzos para detener la destrucción de la naturaleza son titánicos. En lo que va de confinamiento, más de 75 mil hectáreas han sido arrasadas.",https://noticias.caracoltv.com/informes-especiales/las-manos-heroicas-que-estan-detras-de-la-reforestacion-del-amazonas-durante-la-pandemia,
11 DE MARZO DE 2022,EL COLOMBIANO,"La Amazonia podría convertirse en una sabana en 50 años, según estudio
El calentamiento y los daños medioambientales están llevando a la Amazonia a un punto de no retorno que podría convertir, en medio siglo, a uno de los mayores ecosistemas del mundo en una árida sabana, advirtió un estudio en la revista Nature Communications.",https://www.elcolombiano.com/internacional/la-amazonia-podria-convertirse-en-una-sabana-por-danos-al-medio-ambiente-segun-estudio-JF12602964,
19 DE JULIO DE 2021,MONGABAY,"La minería en los ríos de esta zona no es ilegal solo porque carezca de permisos y títulos. También lo es porque viola las leyes de origen de los pueblos indígenas amazónicos como los bora miraña, makuna, uitoto y aduche, a lo largo de las cuencas. Según su cosmogonía, son los espíritus guardianes del agua los únicos que pueden autorizar la extracción del oro. A ellos nadie les ha vuelto a preguntar “y por eso es que llegan las desgracias”, afirma la lideresa uitoto Nazareth Cabrera.",https://es.mongabay.com/2021/07/mineria-ilegal-en-el-rio-caqueta-continua-el-peligro-para-los-indigenas-amazonicos-de-colombia/,
04 DE SEPTIEMBRE DE 2019,NATIONAL GEOGRAFIC," Ningún continente se ha librado del fuego, pero la zona de la que más se habla es de la gran cantidad de incendios que están destruyendo el Amazonas. Aún no se puede saber si el área afectada por incendios es mayor que la del año pasado, pero sí se conoce que, como apuntan desde Greenpeace, el número de incendios surgidos entre enero y finales de agosto ha sido un 145% mayor que en el mismo período de 2018. Aunque también es cierto que el número de incendios de este año no es mayor que la media de los últimos 18 años (desde que los satélites de la NASA son capaces de monitorizarlos), según los datos científicos.",https://www.nationalgeographic.com.es/naturaleza/diferencias-entre-incendios-amazonas-y-espana_14646,
18 DE JULIO DE2019 ,EL TIEMPO,"El estudio 'Contenido de mercurio en comunidades étnicas de la subregión planicie de la Amazonia colombiana' arroja datos alarmantes sobre las consecuencias del mercurio en la salud humana y en el ecosistema de los ríos Caquetá, Apaporis, Puré y Cotuhé. Este territorio ha estado expuesto a varias olas extractivas y conflictos que ponen en riesgo sus ecosistemas. Uno de los fenómenos que ha afectado la zona es la minería ilegal, actividad en la que se utiliza el mercurio, dice el estudio realizado a través de la Dirección Territorial Amazonia, y con el apoyo de la Universidad de Cartagena y la Fundación Gordon and Betty Moore",https://www.eltiempo.com/vida/medio-ambiente/cifras-sobre-el-mercurio-en-la-amazonia-389664,
09 DE ABRIL DE 2023,EL TIEMPO,"El aumento de la minería ilegal amenaza a un pueblo del Amazonas en aislamiento
Desde que comenzó la pandemia la minería ilegal en la Amazonia colombiana ha incrementado. Además de las problemáticas ambientales que trae el mercurio utilizado en estas actividades, monitoreos satelitales evidenciaron que desde 2020 ha aumentado más del 1.000 % sobre el río Puré y los mineros tienen enclaves en el Parque Nacional Natural Río Puré, a pocos kilómetros de un pueblo en aislamiento. Durante 2020, mientras las fronteras de los países estaban cerradas y aumentaban las cifras de contagios de covid-19, la presencia de la minería ilegal entre Colombia y Brasil ganó varios kilómetros. Las implicaciones de esta práctica, que usa contaminantes como el mercurio, son graves para los ríos y la salud de las comunidades circundantes.
",https://www.elespectador.com/ambiente/amazonas/el-aumento-de-la-mineria-ilegal-amenaza-a-un-pueblo-del-amazonas-en-aislamiento/,
01 DE ENERO DE 2023,EPSOCIAL,"Siete de cada diez habitantes de la Amazonía no tienen acceso al agua potable, pese a albergar el 20% de las reservas de agua dulce del planeta, según World Vision que ha lanzado la campaña Iniciativa de la Cuenca Amazónica, coincidiendo con el Día Mundial del Medio Ambiente.",https://www.europapress.es/epsocial/cooperacion-desarrollo/noticia-siete-cada-diez-habitantes-amazonia-no-tienen-acceso-agua-potable-20230531113848.html,
18 DE SEPTIEMBRE DE 2018,WORD ANIMAL PROTECTION,El delfin rosado ha sido cazado pore la carne del animal es usada como carnada para pescar el pez mota.,https://www.worldanimalprotection.cr/problema-matanza-del-delfin-rosado,
14 DE SEPTIEMBRE DE 2020,REUTERS,Jaguares quemados y tornados de fuego: incendios de humedales  son una desoladora advertencia,https://www.reuters.com/article/ambiente-brasil-pantanal-idLTAKBN2652TM,
2021-06-08 00:00:00,IAGUA,"El mercurio dorado amenaza el suelo y las aguas de la Amazonia

A la Amazonia se le reconoce como el bosque tropical y el sistema de ríos más grande del mundo. Es el lugar que alberga el 10% de la biodiversidad del planeta y se extiende por los territorios de 9 países en Latinoamérica. Es el hogar de más de 47 millones de personas, incluyendo 410 grupos indígenas.








",https://www.iagua.es/noticias/banco-mundial/mercurio-dorado-amenaza-suelo-y-aguas-amazonia,CONTAMINACIÓN
2021-09-01 00:00:00,Insight Crime,"Deforestación en la Amazonía colombiana: delimitación del problema

La deforestación es la cara más visible de los delitos ambientales en la Amazonía colombiana.

Desde 2016 aproximadamente, los bosques de la región comenzaron a registrar niveles acelerados de invasión y destrucción. Según el Instituto de Hidrología, Meteorología y Estudios Ambientales (IDEAM) de Colombia, en 2013, año en que la entidad comenzó a producir su informe anual sobre monitoreo de la deforestación, se habían destruido 120.933 hectáreas de bosque. Sin embargo, en 2017 se deforestó un récord de 219.973 hectáreas en Colombia, un 23 por ciento más que en 2016



",https://es.insightcrime.org/investigaciones/deforestacion-amazonia-colombiana-delimitacion-problema/,DEFORESTACIÓN
2021-09-08 00:00:00,Insight Crime,"La minería ilegal en la Amazonía colombiana


A medida que los precios del oro se han disparado, los grupos criminales que antes se dedicaban exclusivamente al tráfico de drogas y armas han incursionado en la minería ilegal.











",https://es.insightcrime.org/investigaciones/mineria-ilegal-amazonia-colombiana/,MINERÍA
2021-09-30 00:00:00,wwf org,"Amazonia colombiana vive una crisis ambiental creciente 

El informe Un clima peligroso analiza las razones del aumento de la deforestación y la violencia contra defensores ambientales, y presenta recomendaciones para su protección.
En Colombia, el informe se presentará de manera oficial este viernes durantela Feria Internacional de Medio Ambiente, FIMA. ",https://www.wwf.org.co/?370297/ocho-organizaciones-advierten-sobre-la-grave-crisis-ambiental-y-de-derechos-humanos-que-vive-la-Amazonia-colombiana,DEFORESTACIÓN
2021-09-30 00:00:00,INFOBAE,"




Cultivos de coca y minería ilegal se dispararon en la Amazonía, advierte organización ambientalista

Este jueves el World Wildlife Fund (WWF) dio a conocer el informe ‘Un clima peligroso: deforestación, cambio climático y violencia contra defensores ambientales en la Amazonía colombiana’ en el que señalan que la desmovilización y el desarme de la Farc creó una especie de vacío de poder en esa zona lo que aumentó la explotación de recursos y de actividades económicas ilegales.










",https://www.infobae.com/america/colombia/2021/09/30/cultivos-de-coca-y-mineria-ilegal-se-dispararon-en-la-amazonia-advierte-organizacion-ambientalista/,MINERÍA
