FECHA ,FUENTE,TEXTO,LINK ,ETIQUETA
2021-10-01 00:00:00,France 24,"La Amazonía colombiana sufre una ""preocupante degradación ambiental""

Cultivos ilícitos, agricultura intensiva, minería ilegal narcotráfico producen una ""preocupante degradación ambiental"" en la Amazonía colombiana, cada vez más golpeada por la deforestación y los ataques contra ambientalistas, denunciaron este jueves varias ONGs.





",https://www.france24.com/es/minuto-a-minuto/20211001-la-amazon%C3%ADa-colombiana-sufre-una-preocupante-degradaci%C3%B3n-ambiental,DEFORESTACIÓN
2021-10-14 00:00:00,Mongabay Periodismo ambiental ,"La Amazonía colombiana se ha convertido en un “botín de guerra”


El informe ‘Un Clima Peligroso’ analiza las razones detrás del aumento de la deforestación y la violencia contra defensores ambientales en la Amazonía colombiana.
Las estrategias del Estado han sido principalmente militares y los operativos puntuales contra la deforestación no son suficientes para solucionar los problemas en una región donde se requiere presencia de todas las entidades del Estado y medidas efectivas para la protección de sus líderes ambientales.


",https://es.mongabay.com/2021/10/amazonia-colombiana-botin-de-guerra-informe/,DEFORESTACIÓN
2021-11-24 00:00:00,CENTRO LATINOAMERICANO DE INVESTIGACION PERIODISTICA ,"El ganado acorrala a la Amazonía

Desde 2016 la población vacuna que circunda a los parques nacionales colombianos La Macarena, Cordillera los Picachos, Tinigua y Serranía del Chiribiquete se ha más que duplicado. Quebrantan así la ecología de reserva que protege la selva más importante del planeta. ¿Por qué y cómo se han podido apropiar los particulares de tierras públicas reservadas?



",https://www.elclip.org/el-ganado-acorrala-a-la-amazonia/,DEFORESTACIÓN
2021-12-01 00:00:00,CONTEXTO GANADERO,"Disidencias de las Farc están destruyendo la Amazonía: Fiscalía

Desde hace varias semanas el sector ganadero viene recibiendo sendas críticas por la situación que ocurre en la Amazonía colombiana, en donde hay una importante deforestación de la selva por cuenta de prácticas como la ganadería extensiva, que están llevando a que se amplíe la frontera agrícola.








",https://www.contextoganadero.com/politica/disidencias-de-las-farc-estan-destruyendo-la-amazonia-fiscalia,DEFORESTACIÓN
2022-01-22 00:00:00,El Espectador ,"Minería ilegal en el Amazonas: otro fenómeno que agudizó la pandemia

Frente al cierre de fronteras en 2020 y la retracción del Gobierno de zonas como la Amazonia, la exploración ilegal de oro en río avanzó kilómetros. Este fenómeno no solo potenció el número de contagios de coronavirus en la región, sino que puso en riesgo a pueblos indígenas en aislamiento, ya que se han reportado balsas mineras hasta a 10 kilómetros de distancia.",https://www.elespectador.com/ambiente/amazonas/mineria-ilegal-en-el-amazonas-otro-fenomeno-que-agudizo-la-pandemia-noticias-colombia/,MINERÍA
2022-02-09 00:00:00,El País,"Arde la Amazonía colombiana

La deforestación desbocada dispara las alarmas de los ambientalistas. EL PAÍS sobrevuela las áreas más afectadas por la tala y quema de bosques








",https://elpais.com/clima-y-medio-ambiente/2022-02-09/arde-la-amazonia-colombiana.html,DEFORESTACIÓN
2022-02-09 00:00:00,EL PAÍS,"Arde la Amazonía colombiana



Las llamas devoran, una vez más, la Amazonía colombiana. Pocos minutos después de que la avioneta despega del aeropuerto de Villavicencio, la puerta de entrada a la inmensidad de las llanuras que dominan la mitad sur de Colombia, se comienza a observar las copiosas columnas de humo. 





",https://elpais.com/clima-y-medio-ambiente/2022-02-09/arde-la-amazonia-colombiana.html,DEFORESTACIÓN
2022-02-10 00:00:00,OPEN DEMOCRACY,"Incendios y derrames de hidrocarburos amenazan la Amazonía colombiana

Los incendios masivos en la Amazonía colombiana superan las cifras para el mes de enero de los últimos diez años, a lo que se añade al menos dos derrames de hidrocarburos.",https://www.opendemocracy.net/es/incendios-y-derrames-de-hidrocarburos-amenazan-amazonia-colombiana/,CONTAMINACIÓN
2022-06-01 00:00:00,El Espectador ,"La Amazonia colombiana fue la cuarta con más deforestación durante 2021

Un nuevo análisis presentado este miércoles por el Proyecto de Monitoreo de la Amazonia Andina (MAAP por sus siglas en inglés) revela los datos de la deforestación e incendios en la región Amazónica latinoamericana. Los datos, presentados por la Universidad de Maryland, indican que durante 2021 se perdieron aproximadamente dos millones de hectáreas de bosque primario en los nueve países del bioma amazónico.",https://www.elespectador.com/ambiente/la-amazonia-colombiana-fue-la-cuarta-con-mas-deforestacion-durante-2021/,DEFORESTACIÓN
2022-07-15 00:00:00,FCDS,"La Amazonia colombiana perdió 113.572 hectáreas de bosque


Desde abril del 2021 a marzo del 2022 la FCDS analizó un área que comprende algunos municipios de los departamentos del Guaviare, Caquetá y Meta. Además, esta vez se incluyó Puerto Leguízamo, Putumayo. Los datos arrojan un incremento de hectáreas deforestadas en Parques Nacionales y resguardos indígenas.
",https://fcds.org.co/publicaciones/la-amazonia-colombiana-perdio-113-572-hectareas-de-bosque/,DEFORESTACIÓN
2022-08-19 00:00:00,DW NOTICIAS,"Colombia propone fondo internacional para proteger la Amazonía


El presidente Gustavo Petro también llamó a la fuerza pública a capturar a los ""grandes depredadores de la selva amazónica"" colombiana.







",https://www.dw.com/es/colombia-propone-fondo-internacional-para-proteger-la-amazon%C3%ADa/a-62860684,DEFORESTACIÓN
2022-08-29 00:00:00,MAS COLOMBIA,"El 70% de la deforestación en Colombia se concentra en la Amazonía


Si bien Colombia es el segundo país más biodiverso del mundo, enfrenta una grave amenaza: la deforestación. En 2021, esta se incrementó en 1,5% frente al año anterior, hasta afectar 174.103 hectáreas de bosque natural, un área casi tan extensa como Bogotá.",https://mascolombia.com/el-70-de-la-deforestacion-en-colombia-se-concentra-en-la-amazonia/,DEFORESTACIÓN
2022-09-12 00:00:00,Mongabay Periodismo ambiental ,"La Amazonía colombiana perdió más de 52 mil hectáreas de bosque en el primer semestre de 2022  


Tan solo un mes y medio después de que Iván Duque dejó la Presidencia, el gobierno de Gustavo Petro presentó cifras actualizadas que muestran que la tendencia de la pérdida de bosques este año viene en aumento.
La ministra de Ambiente, Susana Muhamad, aseguró que se hizo un análisis de dos décadas y reveló que, entre 2001 y 2021, se deforestaron 3 182 876 hectáreas, de las cuales 1 858 285 (58 %) corresponden a la Amazonía del país.",https://es.mongabay.com/2022/09/amazonia-colombiana-perdio-mas-de-52-mil-hectareas-de-bosque/,DEFORESTACIÓN
2022-09-13 00:00:00,INFOBAE,"Destrucción del Amazonas: autoridades colombianas detuvieron brasileros que estaban afectando ocho kilómetros de río y selva



Los individuos llevaban a cabo actividades de minería ilegal en la zona en complicidad con el grupo armado organizado residual Estructura 48, Comandos de Frontera",https://www.infobae.com/america/colombia/2022/09/13/destruccion-del-amazonas-autoridades-colombianas-detuvieron-brasileros-que-estaban-afectando-ocho-kilometros-de-rio-y-selva/,MINERÍA
2022-12-02 00:00:00,RADIO NACIONAL DE COLOMBIA,"Ganadería extensiva, uno de los motores de la deforestación en Colombia


Según cifras del Ideam, solo en 2021 se deforestaron 174.113 hectáreas en el país, especialmente en la Amazonía.






",https://www.radionacional.co/actualidad/medio-ambiente/deforestacion-en-colombia-ganaderia-extensiva-y-sus-consecuencias,DEFORESTACIÓN
2023-02-09 00:00:00,DW NOTICIAS,"Brasil y Colombia luchan contra la minería ilegal del oro

La minería ilegal del oro amenaza el medio ambiente y a los pueblos indígenas de varios países sudamericanos. Brasil y Colombia han lanzado operaciones policiales y militares para luchar contra las explotaciones ilícitas, enviando efectivos a las regiones afectadas de la Amazonía.






",https://www.dw.com/es/brasil-y-colombia-luchan-contra-la-miner%C3%ADa-ilegal-del-oro/av-64650784,MINERÍA
1 de septiembre del 2021,EL ESPECTADOR,"Tras la raíz de los crímenes ambientales de la Amazonia

La compleja red de actores que han impulsado delitos como la deforestación, la minería ilegal y el tráfico de especies en la Amazonia en la última década son revelados en un nuevo informe de Insight Crime.",https://www.elespectador.com/ambiente/amazonas/tras-la-raiz-de-los-crimenes-ambientales-de-la-amazonia/,DEFORESTACIÓN
13 de febrero de 2022,NOTIICAS CARACOL ,"SOS por la Amazonía colombiana: 600.000 hectáreas han sido arrasadas en los últimos 5 años

Los bosques tienen enemigos claros: acaparamiento de tierras, ganadería extensiva, cultivos ilícitos, minería ilegal y tala. ¿Vamos a perder este pulmón?









",https://noticias.caracoltv.com/colombia/sos-por-la-amazonia-colombiana-600-000-hectareas-han-sido-arrasadas-en-los-ultimos-5-anos,DEFORESTACIÓN
16 de diciembre de 2020,MEER,"La tala ilegal en el Amazonas colombiano
Prácticas que legitiman el tráfico



En Colombia hay muchas normas para proteger el medio ambiente y, entre ellas, las suficientes para luchar contra la tala ilegal que ocasiona el 10% de la deforestación en el país. No obstante, en algún punto de la cadena de comercialización, gran parte de la madera que proviene de un área protegida pasa como legal. Esta madera, en su mayoría, se extrae del mayor bosque lluvioso tropical del planeta: el Amazonas.




",https://www.meer.com/es/63203-la-tala-ilegal-en-el-amazonas-colombiano,TALA ILEGAL
16 de junio de 2022,EL ESPECTADOR,"“Ganadería genera 60 veces más deforestación que el área por coca en la Amazonía”


Así lo concluye Paulo Murillo, topógrafo y PhD en geografía de la Oregon State University, en su tesis doctoral sobre la expansión de los cultivos de coca y ganadería extensiva en el posconflicto. Afirma que habitantes de los territorios se debaten entre su supervivencia y la protección del medioambiente.






",https://www.elespectador.com/colombia-20/conflicto/ganaderia-extensiva-es-el-principal-factor-deforestacion-en-la-amazonia-y-no-la-coca-dice-investigador/,DEFORESTACIÓN
19 de septiembre 2018,RADIO NACIONAL DE COLOMBIA,"Cultivos ilícitos crecieron un 17% en Colombia: UNODC

Por: Colprensa.La Oficina de Naciones Unidas contra la Droga y el Delito (UNODC) entregó el informe de monitoreo de cultivos ilícitos en Colombia, el cual registró en 2017 un crecimiento del 17% frente al 2016, para un total de 171 mil hectáreas cultivadas con coca en el país.

En la Amazonía se encontraron 302 hectáreas, 6% más que en 2016


",https://www.radionacional.co/cultura/cultivos-ilicitos-crecieron-un-17-en-colombia-unodc,CULTIVOS ILICITOS 
21 de marzo de 2021,wwf org,"La tala ilegal está devorando la selva colombiana: ¿quién está detrás?
Posted on 21 marzo 2021

Conoce a través de un video explicativo qué hechos de corrupción y criminalidad impulsan este fenómeno en el país y lo que podemos hacer desde nuestra cotidianidad para no contribuir a este negocio ilícito.








",https://www.wwf.org.co/?366170/La-tala-ilegal-esta-devorando-la-selva-colombiana-quien-esta-detrás,TALA ILEGAL
21 de noviembre de 2015,BBC,"Amazonía: la deforestación amenaza la mitad de las especies de árboles

Más de la mitad de las especies de árboles de la Amazonía están amenazadas, advirtió un estudio en el que participaron más de 150 científicos de 21 países.
Hasta ahora no existía una estimación fiable sobre cuántas especies de árboles estaban amenazadas.









",https://www.bbc.com/mundo/noticias/2015/11/151121_amazonia_arboles_extincion_am,DEFORESTACIÓN
23 de octubre 2013,EL TIEMPO ,,https://www.eltiempo.com/archivo/documento/CMS-13140404,DEFORESTACIÓN
24  de octubre 2023,SEMANA,,https://www.semana.com/nacion/articulo/amazonas-cultivos-ilicitos-deforestacion/362233-3/,DEFORESTACIÓN
24 de octubre 2013,MI PUTUMAYO NOTICIAS,"Cultivos ilícitos y deforestación, principales males de la Amazonía

Caquetá, Guaviare y Putumayo son los departamentos que han perdido más bosques.

Una deforestación que avanza sobre 87 mil hectáreas de bosque, impulsada por la contaminación y la llegada de empresas dedicadas a la explotación de la vegetación, y el incremento de los cultivos ilícitos se han consolidado como dos de los principales problemas que enfrenta la Amazonía colombiana.",ttps://miputumayo.com.co/2013/10/24/cultivos-ilicitos-y-deforestacion-principales-males-de-la-amazonia/,CULTIVOS ILICITOS Y DEFORESTACION 
30 de mayo de 2023,SEMANA,"Sucumbe la Amazonia colombiana: 75.000 hectáreas deforestadas este año

Vías, ganadería, coca, grupos armados y sequía, las principales causas. Así lo revela un análisis de la Fundación para la Conservación y Desarrollo Sostenible. Alertas del Ideam indican que en todo 2019, la región perdió 73.000 hectáreas.













",https://www.semana.com/impacto/articulo/sucumbe-la-amazonia-colombiana-75000-hectareas-deforestadas-este-ano/51466/,DEFORESTACIÓN
4 de mayo de 2015,AVADA,"Colombia | minería ilegal amenaza a diez especies de animales

La devastación que la minería ilegal deja a su paso ya está afectando varias especies de animales que habitan la selva colombiana. De acuerdo con un reporte del diario “El Universal“, son diez las especies damnificadas por la explotación ilegal de oro, coltán y hasta uranio. Tales actividades ilícitas tienen presencia en 12 regiones del país que incluyen 21 departamentos, según datos brindados por la Dirección Nacional de Fiscalías sobre minería ilegal.









",https://www.lasrutasdeloro.com/colombia-mineria-ilegal-amenaza-a-diez-especies-de-animales/,MINERÍA
6 de abril de 2021,CODS CENTRO DE LOS OBJETIVOS PARA EL DESARROLLO SOSTENIBLE PARA AMERRICA LATINA,"EL PESO DE LA COCA EN LA DEFORESTACION AMAZONICA 


El cultivo de la hoja de coca en la región de la Amazonia viene desde los tiempos ancestrales. Las comunidades amazónicas cuentan que los grupos indígenas que han habitado este territorio históricamente han sembrado coca, entre ellos los huitotos, muinane, andoques, nonuyas, mirañas, yucunas y matapís.









",https://cods.uniandes.edu.co/el-peso-de-la-coca-en-la-deforestacion-amazonica/,DEFORESTACIÓN
7 de julio de 2021,BLUE RADIO,"

Colombia perdió una área de bosque más grande que Bogotá en 2020


Colombia perdió 1.718 kilómetros cuadrados de bosque en 2020, un 
área ligeramente mayor a la de una ciudad de casi 8 millones de habitantes como Bogotá y que representa un aumento de 8% en comparación con el año anterior, informó este miércoles el Ministerio de Ambiente.

La tala y quema de bosques afectó principalmente (64%) a la Amazonía, el mayor bosque tropical del mundo que comparte con Brasil, Perú, Bolivia, Ecuador, Venezuela, Surinam, Guyana y Guayana Francesa.















",https://www.bluradio.com/medio-ambiente/deforestacion-en-colombia-aumento-8-en-2020-segun-minambiente,DEFORESTACIÓN
2016-10-21 00:00:00,EL ESPECTADOR,"Colombia ya destrozó un equivalente a 5 millones de canchas de futbol en el Amazonas, Una situación que preocupa a los investigadores es que la tasa a la  que se recuperan los bosques transformados es muy inferior a la tasa a la que son talados. Entre 2012 y 2014, los dos años analizados en los mapas, 445.000 hectáreas se transformaron en áreas seminaturales o transformadas. En ese mismo periodo de tiempo tan sólo 43.200 hectáreas se restauraron. Es decir, apenas un 10% se recuperó.",https://www.elespectador.com/ambiente/colombia-ya-destrozo-el-equivalente-a-5-millones-de-canchas-de-futbol-en-el-amazonas-article-661527/,DEFORESTACIÓN
12 de Septiembre 2022,global investivative journalism network ,"reportaron más de 1.200 derrames de petróleo en el área. Las poblaciones indígenas, así como la flora y fauna de la selva, sufren diariamente las consecuencias de manera más directa. la situación en el Amazonas empeora debido a las fallas de las autoridades para tratar con los perpetradores y prevenir los derrames",https://gijn.org/2022/09/12/espanol-investigar-derrames-petroleo/,derrame de petrolio 
18 de mayo de 2023,EL TIEMPO ,"LA MAYOR PARTE DEL HOLLIN SOBRE EL AMAZONAS VIENE DE AFRICA:                                                                                                                                                                                                los investigadores descubrieron que los incendios forestales y la sabana en llamas en el norte y el sur de África contribuyen sustancialmente a la contaminación del aire en la Amazonía central durante todo el año, por lo que juegan un papel importante en el balance de radiación de la tierra y el ciclo del agua. ",https://www.eltiempo.com/vida/medio-ambiente/la-mayor-parte-del-hollin-sobre-el-amazonas-viene-de-africa-769864,
16 de mayo 2016,NEWS MUNDO ,"Según la OPIAC, los menores fueron asesinados entre el Amazonas y el Caquetá, al sur de Colombia.                    La matanza de 4 menores en colombia por la que el presidente petro suspendio el cese al fuego con las disidencias de las FARC . El hecho fue denunciado tres días despues por la organizacion Nacional Nacional de los pueblos indígenas de la Amazonía Colombia (OPIAC) en redes sociales. ",https://www.bbc.com/mundo/noticias-america-latina-65605987,NARCOTRAFICO
17 de marzo del 2020 ,EL ESPECTADOR ,"Otro fenómeno que agudizó la pandemia
Frente al cierre de fronteras en 2020 y la retracción del Gobierno de zonas como la Amazonia, la exploración ilegal de oro en río avanzó kilómetros. Este fenómeno no solo potenció el número de contagios de coronavirus en la región, sino que puso en riesgo a pueblos indígenas en aislamiento, ya que se han reportado balsas mineras hasta a 10 kilómetros de distancia.",https://www.elespectador.com/ambiente/amazonas/mineria-ilegal-en-el-amazonas-otro-fenomeno-que-agudizo-la-pandemia-noticias-colombia/,MINERIA ILEGAL 
5 ABRIL 2018,CORTE SUPREMA DE COLOMBIA,"Tras advertir el alarmante incremento del 44% en la deforestación en la región –de 56.952 a 70.074 hectáreas entre 2015 y 2016– y que el Estado no ha enfrentado eficientemente esta problemática ambiental, la Corte Suprema de Justicia ordenó a la Presidencia de la República y a las demás autoridades nacionales, regionales y municipales involucradas en esta responsabilidad, adoptar un plan de acción de corto, mediano y largo plazo para proteger a la Amazonía Colombiana.",https://cortesuprema.gov.co/corte/index.php/2018/04/05/corte-suprema-ordena-proteccion-inmediata-de-la-amazonia-colombiana/,PLAN CONTRA LA PROTECCIÓN INMEDIATA DE LA AMAZONIA
27 OCTUBRE 2022,EL PAÍS-AMERICA FUTURA,"El bajo nivel del río afecta ya a todos los 62 municipios que componen el estado brasileño de Amazonia. En algunos puntos en los que el río todavía fluye, el nivel de profundidad es de hasta 35 centímetros, por lo que las imágenes de pescadores arrastrando sus embarcaciones se torna bastante común. En la fotografía, un barco varado por las sequías en Lagoa da Francesa, en el municipio de Parintinis, el 21 de octubre de 2022.",https://elpais.com/america-futura/2022-10-27/la-amazonia-agoniza-por-las-sequias.html,SEQUIA EN LA AMAZONÍA 
12 DE MARZO 2022,NATIONAL GEOGRAPHIC ,"Este ecosistema podría perder su capacidad de absorción de carbono, ha comenzado a emitir más CO2 del que absorbe debido a la creciente deforestación y los incendios, se debe principalmente a la actividad humana relacionada con la tala que ha enfrentado en los últimos año, al menos tres cuartos de la Amazonía han perdido la capacidad de recuperarse de fenómenos adverso.",https://www.ngenespanol.com/ecologia/la-amazonia-esta-a-punto-de-sucumbir-ante-la-crisis-climatica-y-convertirse-en-una-sabana/,cambio climatico 
2 DE OCTUBRE 2018,SEMANA ,El Igac dice que los suelos del Caquetá y Putumayo son los más afectados en la Amazonia colombiana. La degradación de este recurso natural por la pérdida de bosque en las zonas montañosas intensifica los derrumbes y desbordamientos de los ríos.,https://www.semana.com/impacto/articulo/casi-2-millones-de-hectareas-de-suelo-de-la-amazonia-con-dano-irreversible-por-ganaderia/41783/,AGOTAMIENTO DE LOS SUELOS EN LA AMAZONÍA
01 DE SEPTIEMBRE DE 2021,EFEverde,"Especies amenazadas pierden buena parte del hábitat por fuegos en el Amazonas
Hasta el 85% de las especies catalogadas como amenazadas en el Amazonas pueden haber perdido una parte sustancial de su hábitat debido a la deforestación y los incendios en las últimas dos décadas.",https://efeverde.com/amazonas/,DEFORESTACION
07 de octubre del 2020,EFEverde,"La minería degrada y socava la riqueza de los territorios indígenas en Amazonía
Las actividades mineras en la cuenca amazónica vierten químicos tóxicos a más de 30 ríos en la Amazonía, ocupan más del 20 % de territorios indígenas y ponen en peligro ecosistemas críticos por la creciente deforestación, según revela un informe difundido por la organización World Resources Institute.",https://efeverde.com/amazonas/page/2/,MINERIA
06 DE ABRIL DE 2021,CODS,"los cultivos de coca inciden en la destrucción de los bosques en la medida que permiten abrir la puerta a otras actividades productivas con mayor impacto directo, como la ganadería.  la dinámica de la deforestación a raíz de los cultivos de uso ilícito varía cuando se ponen en el radar a los parques nacionales naturales (PNN). Si bien el número de hectáreas a nivel regional aún no parece ser importante, sí existe una correlación entre la pérdida de bosque y el aumento de los cultivos de uso ilícito dentro de áreas protegidas. En particular, Cealdes resalta el caso del PNN Sierra de La Macarena, un área protegida marcada, entre otras cosas, por el establecimiento de cultivos de coca.","https://cods.uniandes.edu.co/el-peso-de-la-coca-en-la-deforestacion-amazonica/#:~:text=Cultivos%20de%20uso%20il%C3%ADcito%20en,hect%C3%A1reas%2C%20seg%C3%BAn%20datos%20de%20Cealdes.",DEFORESTACION A CAUSA DE CULTIVOS ILICITOS
5 DE OCTUBRE 2020,EFEverde,"El 40 % del Amazonas puede convertirse en un ecosistema tipo sabana.
Una gran parte de la selva amazónica, un 40 %, está en riesgo de convertirse en un ecosistema del tipo sabana, mientras aumenta el calentamiento de la región por las emisiones contaminantes
",https://efeverde.com/amazonas-ecosistema-tipo-sabana/,CONTAMINACION AMBIENTAL
20 DE FEBRERO 2023,LA REPUBLICA,"Se encontró que aunque los ranchos ganaderos talaron más de tres millones de hectáreas (7,4 millones de acres) de selva amazónica en 2018, el impacto de la coca fue insignificante pues solo 45.000 hectáreas (111.200 acres) fueron taladas para cultivo de coca en ese mismo año.   “Queremos erradicar finalmente esta narrativa de que la coca es el motor de la deforestación”, dijo Murillo Sandoval.",https://www.larepublica.co/economia/estudio-demostro-que-ganaderia-afecta-mas-a-la-selva-amazonica-que-cultivos-de-coca-3549923,CULTIVOS ILICITOS Y GANADERIA
25 DE MAYO DE 2023,EL TIEMPO ,"Por un período de diez años, los investigadores analizarán los procesos que ocurren en las hojas, las raíces, el suelo, los ciclos del agua y los nutrientes. ""Tendremos proyecciones más precisas: por un lado, sobre cómo la selva amazónica puede ayudar a combatir el cambio climático con su capacidad de absorber carbono de la atmósfera; y por otro, nos ayudará a entender cómo la selva se verá impactada por esos cambios"", dijo David Lapola, investigador de la Universidad de Campinas, que coordina el proyecto junto a Quesada.",https://www.eltiempo.com/vida/medio-ambiente/cientificos-simularan-cambio-climatico-en-la-amazonia-para-estudiar-sus-efectos-771757,cambio climatico 
27 DE JUNIO 2015,EL ESPECTADOR ,"LOS RIOS QUE LAS FARC PINTARON DE NEGRO                            El conflicto armado se ensaña con la población civil, pero también con humedales, ríos, montañas, animales y plantas. Para nadie es un secreto que el medio ambiente también debería ser considerado una víctima de la guerra en Colombia. los ríos Catatumbo y Tibú, en Norte de Santander; Caunapí, Rosario, Mira y Sucio, en Nariño, y Cuembí, en Putumayo, se han visto gravemente afectados por derrames de petróleo que han ocasionando daños irreparables a su fauna y flora, poniendo en riesgo la seguridad alimentaria y económica de aproximadamente 84.000 campesinos, indígenas y pescadores que dependen de estos ecosistemas.                                                                                                                                                                                                                                              ",https://www.elespectador.com/ambiente/los-rios-que-las-farc-pintaron-de-negro-article-568911/,
